{
  "$schema": "./schemas/scene.schema.json",
  "cardAspect": 1.4142857142857144,
  "exposedFraction": 0.3333333333333333,
  "backgroundWave": 0.78,
  "selectionWave": 0.82,
  "idleWave": 1,
  "rowDamping": 3.7,
  "laneDamping": 6.2,
  "hoverLift": 0.28,
  "wheelRowThreshold": 100,
  "wheelLaneThreshold": 150,
  "wheelCooldown": 160,
  "pixelRatio": 1.5,
  "depthOfField": 0,
  "exposure": 0.98,
  "reduceMotion": false,
  "floor": "#090c0f",
  "fog": "#0b1014",
  "polymer": "#626b70",
  "edges": "#687277",
  "diffuser": "#192226",
  "fasteners": "#b1b9bb",
  "inlay": "#c6a36b",
  "printedLabel": "#303a3e",
  "optics": "#939e9f",
  "opticalEdges": "#bbc3bc",
  "ink": "#b6bdb8",
  "lightweightGeometry": true,
  "showCategoryBoxes": true,
  "categoryBoxWidth": 4.3,
  "categoryBoxDepth": 2.3,
  "categoryBoxHeight": 0.48,
  "categoryBoxGap": 0.6,
  "categoryBoxElevation": 3.2,
  "categoryBoxSideExtension": 0.4,
  "categoryBoxRearExtension": 0.8,
  "categoryBoxLogoScale": 0.72
}
